id,name,original_title,original_language,overview,genres,status,popularity,adult,vote_average,vote_count,release_date
468,Solaris,Солярис,ru,"A psychologist is sent to a space station orbiting a planet called Solaris to investigate the death of a doctor and the mental problems of cosmonauts on the station. He soon discovers that the water on the planet is a type of brain which brings out repressed memories and obsessions.","[{""id"":18,""name"":""Drama""},{""id"":878,""name"":""Science Fiction""},{""id"":9648,""name"":""Mystery""}]",Released,20.541,,7.818,1582,1972-03-20
469,"The Terminal","The Terminal",en,"Viktor Navorski is a man without a country; his plane took off just as a coup d'etat exploded in his homeland, leaving it in shambles, and now he's stranded at Kennedy Airport, where he's holding a passport that nobody recognizes. While quarantined in the transit lounge until authorities can figure out what to do with him, Viktor simply goes on living – and courts romance with a beautiful flight attendant.","[{""id"":35,""name"":""Comedy""},{""id"":18,""name"":""Drama""}]",Released,33.264,,7.346,7849,2004-06-17
470,"To Kill a Mockingbird","To Kill a Mockingbird",en,"Scout Finch, 6, and her older brother Jem live in sleepy Maycomb, Alabama, spending much of their time with their friend Dill and spying on their reclusive and mysterious neighbor, Boo Radley. When Atticus, their widowed father and a respected lawyer, defends a black man named Tom Robinson against fabricated rape charges, the trial and tangent events expose the children to evils of racism and stereotyping.","[{""id"":18,""name"":""Drama""}]",Released,23.62,,8,2584,1962-12-20
471,"The Grapes of Wrath","The Grapes of Wrath",en,"Tom Joad returns to his home after a jail sentence to find his family kicked out of their farm due to foreclosure. He catches up with them on his Uncle’s farm, and joins them the next day as they head for California and a new life... Hopefully.","[{""id"":18,""name"":""Drama""}]",Released,10.552,,7.8,968,1940-03-15
472,Titanic,Titanic,en,"101-year-old Rose DeWitt Bukater tells the story of her life aboard the Titanic, 84 years later. A young Rose boards the ship with her mother and fiancé. Meanwhile, Jack Dawson and Fabrizio De Rossi win third-class tickets aboard the ship. Rose tells the whole story from Titanic's departure through to its death—on its first and last voyage—on April 15, 1912.","[{""id"":18,""name"":""Drama""},{""id"":10749,""name"":""Romance""}]",Released,141.092,,7.906,25289,1997-11-18
473,"City of God","Cidade de Deus",pt,"In the poverty-stricken favelas of Rio de Janeiro in the 1970s, two young men choose different paths. Rocket is a budding photographer who documents the increasing drug-related violence of his neighborhood, while José “Zé” Pequeno is an ambitious drug dealer diving into a dangerous life of crime.","[{""id"":18,""name"":""Drama""},{""id"":80,""name"":""Crime""}]",Released,48.091,,8.425,7365,2002-08-30
474,"Sunset Boulevard","Sunset Boulevard",en,"A hack screenwriter writes a screenplay for a former silent film star who has faded into Hollywood obscurity.","[{""id"":18,""name"":""Drama""}]",Released,22.664,,8.31,2562,1950-08-10
475,"Full Metal Jacket","Full Metal Jacket",en,"A pragmatic U.S. Marine observes the dehumanizing effects the U.S.-Vietnam War has on his fellow recruits from their brutal boot camp training to the bloody street fighting in Hue.","[{""id"":18,""name"":""Drama""},{""id"":10752,""name"":""War""}]",Released,58.183,,8.129,10429,1987-06-26
476,"E.T. the Extra-Terrestrial","E.T. the Extra-Terrestrial",en,"An alien is left behind on Earth and saved by the 10-year-old Elliot who decides to keep him hidden in his home. While a task force hunts for the extra-terrestrial, Elliot, his brother, and his little sister Gertie form an emotional bond with their new friend, and try to help him find his way home.","[{""id"":878,""name"":""Science Fiction""},{""id"":12,""name"":""Adventure""},{""id"":10751,""name"":""Family""},{""id"":14,""name"":""Fantasy""}]",Released,45.066,,7.517,11137,1982-06-11
477,"Independence Day","Independence Day",en,"Strange phenomena surface around the globe. The skies ignite. Terror races through the world's major cities. As these extraordinary events unfold, it becomes increasingly clear that a force of incredible magnitude has arrived. Its mission: total annihilation over the Fourth of July weekend. The last hope to stop the destruction is an unlikely group of people united by fate and unimaginable circumstances.","[{""id"":28,""name"":""Action""},{""id"":12,""name"":""Adventure""},{""id"":878,""name"":""Science Fiction""}]",Released,50.336,,6.889,9513,1996-06-25
478,"The Matrix","The Matrix",en,"Set in the 22nd century, The Matrix tells the story of a computer hacker who joins a group of underground insurgents fighting the vast and powerful computers who now rule the earth.","[{""id"":28,""name"":""Action""},{""id"":878,""name"":""Science Fiction""}]",Released,91.797,,8.218,25599,1999-03-31
479,"The Matrix Reloaded","The Matrix Reloaded",en,"Six months after the events depicted in The Matrix, Neo has proved to be a good omen for the free humans, as more and more humans are being freed from the matrix and brought to Zion, the one and only stronghold of the Resistance.  Neo himself has discovered his superpowers including super speed, ability to see the codes of the things inside the matrix and a certain degree of pre-cognition. But a nasty piece of news hits the human resistance: 250,000 machine sentinels are digging to Zion and would reach them in 72 hours. As Zion prepares for the ultimate war, Neo, Morpheus and Trinity are advised by the Oracle to find the Keymaker who would help them reach the Source.  Meanwhile Neo's recurrent dreams depicting Trinity's death have got him worried and as if it was not enough, Agent Smith has somehow escaped deletion, has become more powerful than before and has fixed Neo as his next target.","[{""id"":12,""name"":""Adventure""},{""id"":28,""name"":""Action""},{""id"":53,""name"":""Thriller""},{""id"":878,""name"":""Science Fiction""}]",Released,63.958,,7.053,10903,2003-05-15
480,"The Matrix Revolutions","The Matrix Revolutions",en,"The human city of Zion defends itself against the massive invasion of the machines as Neo fights to end the war at another front while also opposing the rogue Agent Smith.","[{""id"":12,""name"":""Adventure""},{""id"":28,""name"":""Action""},{""id"":53,""name"":""Thriller""},{""id"":878,""name"":""Science Fiction""}]",Released,44.384,,6.728,9831,2003-11-05
481,"Out of Africa","Out of Africa",en,"Tells the life story of Danish author Karen Blixen, who at the beginning of the 20th century moved to Africa to build a new life for herself. The film is based on her 1937 autobiographical novel.","[{""id"":36,""name"":""History""},{""id"":10749,""name"":""Romance""},{""id"":18,""name"":""Drama""}]",Released,13.928,,7.173,1359,1985-12-20
482,"Men in Black","Men in Black",en,"After a police chase with an otherworldly being, a New York City cop is recruited as an agent in a top-secret organization established to monitor and police alien activity on Earth: the Men in Black. Agent K and new recruit Agent J find themselves in the middle of a deadly plot by an intergalactic terrorist who has arrived on Earth to assassinate two ambassadors from opposing galaxies.","[{""id"":28,""name"":""Action""},{""id"":12,""name"":""Adventure""},{""id"":35,""name"":""Comedy""},{""id"":878,""name"":""Science Fiction""}]",Released,42.581,,7.202,13683,1997-07-02
483,"Men in Black II","Men in Black II",en,"Kay and Jay reunite to provide our best, last and only line of defense against a sinister seductress who levels the toughest challenge yet to the MIB's untarnished mission statement – protecting Earth from the scum of the universe. It's been four years since the alien-seeking agents averted an intergalactic disaster of epic proportions. Now it's a race against the clock as Jay must convince Kay – who not only has absolutely no memory of his time spent with the MIB, but is also the only living person left with the expertise to save the galaxy – to reunite with the MIB before the earth submits to ultimate destruction.","[{""id"":28,""name"":""Action""},{""id"":35,""name"":""Comedy""},{""id"":878,""name"":""Science Fiction""}]",Released,34.824,,6.371,9851,2002-07-03
484,Poltergeist,Poltergeist,en,"Upon realizing that something truly evil haunts his home, Steve Freeling calls in a team of parapsychologists to help before it's too late.","[{""id"":27,""name"":""Horror""}]",Released,25.119,,7.145,2985,1982-06-04
485,Munich,Munich,en,"During the 1972 Olympic Games in Munich, eleven Israeli athletes are taken hostage and murdered by a Palestinian terrorist group known as Black September. In retaliation, the Israeli government recruits a group of Mossad agents to track down and execute those responsible for the attack.","[{""id"":18,""name"":""Drama""},{""id"":28,""name"":""Action""},{""id"":36,""name"":""History""},{""id"":53,""name"":""Thriller""}]",Released,23.358,,7.2,2615,2005-12-23
486,Downfall,"Der Untergang",de,"In April of 1945, Germany stands at the brink of defeat with the Russian Army closing in from the east and the Allied Expeditionary Force attacking from the west. In Berlin, capital of the Third Reich, Adolf Hitler proclaims that Germany will still achieve victory and orders his generals and advisers to fight to the last man. When the end finally does come, and Hitler lies dead by his own hand, what is left of his military must find a way to end the killing that is the Battle of Berlin, and lay down their arms in surrender.","[{""id"":18,""name"":""Drama""},{""id"":36,""name"":""History""},{""id"":10752,""name"":""War""}]",Released,16.622,,7.86,3812,2004-09-16
487,"Wild Strawberries",Smultronstället,sv,"Crotchety retired doctor Isak Borg travels from Stockholm to Lund, Sweden, with his pregnant and unhappy daughter-in-law, Marianne, in order to receive an honorary degree from his alma mater. Along the way, they encounter a series of hitchhikers, each of whom causes the elderly doctor to muse upon the pleasures and failures of his own life. These include the vivacious young Sara, a dead ringer for the doctor's own first love.","[{""id"":18,""name"":""Drama""}]",Released,15.266,,8.138,1618,1957-08-28
488,"The Passion of the Christ","The Passion of the Christ",en,"A graphic portrayal of the last twelve hours of Jesus of Nazareth's life.","[{""id"":18,""name"":""Drama""}]",Released,63.328,,7.5,4559,2004-02-25
489,"The Last Samurai","The Last Samurai",en,"Nathan Algren is an American hired to instruct the Japanese army in the ways of modern warfare, which finds him learning to respect the samurai and the honorable principles that rule them. Pressed to destroy the samurai's way of life in the name of modernization and open trade, Algren decides to become an ultimate warrior himself and to fight for their right to exist.","[{""id"":18,""name"":""Drama""},{""id"":28,""name"":""Action""},{""id"":10752,""name"":""War""}]",Released,54.382,,7.6,6812,2003-12-05
490,"Wild Things","Wild Things",en,"When teen-socialite Kelly Van Ryan and troubled bad girl Suzie Toller accuse guidance counselor Sam Lombardo of rape, he's suspended by the school, rejected by the town, and fighting to get his life back. One cop suspects conspiracy, but nothing is what it seems...","[{""id"":9648,""name"":""Mystery""},{""id"":53,""name"":""Thriller""},{""id"":18,""name"":""Drama""}]",Released,24.474,,6.356,1720,1998-03-20
491,"The Birth of a Nation","The Birth of a Nation",en,"Two families, abolitionist Northerners the Stonemans and Southern landowners the Camerons, intertwine. When Confederate colonel Ben Cameron is captured in battle, nurse Elsie Stoneman petitions for his pardon. In Reconstruction-era South Carolina, Cameron founds the Ku Klux Klan, battling Elsie's congressman father and his African-American protégé, Silas Lynch.","[{""id"":18,""name"":""Drama""},{""id"":36,""name"":""History""},{""id"":10752,""name"":""War""}]",Released,12.398,,6,521,1915-02-08
492,"The Bodyguard","The Bodyguard",en,"A former Secret Service agent grudgingly takes an assignment to protect a pop idol who's threatened by a crazed fan. At first, the safety-obsessed bodyguard and the self-indulgent diva totally clash. But before long, all that tension sparks fireworks of another sort, and the love-averse tough guy is torn between duty and romance.","[{""id"":28,""name"":""Action""},{""id"":18,""name"":""Drama""},{""id"":10749,""name"":""Romance""}]",Released,35.556,,6.689,2926,1992-11-25
493,Ghostbusters,Ghostbusters,en,"After losing their academic posts at a prestigious university, a team of parapsychologists goes into business as proton-pack-toting ""ghostbusters"" who exterminate ghouls, hobgoblins and supernatural pests of all stripes. An ad campaign pays off when a knockout cellist hires the squad to purge her swanky digs of demons that appear to be living in her refrigerator.","[{""id"":35,""name"":""Comedy""},{""id"":14,""name"":""Fantasy""}]",Released,43.392,,7.489,8896,1984-06-08
494,Grease,Grease,en,"Australian good girl Sandy and greaser Danny fell in love over the summer. But when they unexpectedly discover they're now in the same high school, will they be able to rekindle their romance despite their eccentric friends?","[{""id"":10749,""name"":""Romance""},{""id"":35,""name"":""Comedy""}]",Released,49.823,,7.392,7168,1978-07-07
495,"The Ninth Gate","The Ninth Gate",en,"An all-expenses-paid international search for a rare copy of the book 'The Nine Gates of the Kingdom of Shadows' brings an unscrupulous book dealer deep into a world of murder, double-dealing and Satanic worship.","[{""id"":9648,""name"":""Mystery""},{""id"":53,""name"":""Thriller""},{""id"":27,""name"":""Horror""}]",Released,22.083,,6.5,2979,1999-08-25
496,"A Fish Called Wanda","A Fish Called Wanda",en,"While a diamond advocate attempts to steal a collection of diamonds, troubles arise when he realises he’s not the only one after the collection.","[{""id"":35,""name"":""Comedy""},{""id"":80,""name"":""Crime""}]",Released,11.338,,7.202,2137,1988-07-15
497,"Easy Rider","Easy Rider",en,"Wyatt and Billy, two Harley-riding hippies, complete a drug deal in Southern California and decide to travel cross-country in search of spiritual truth.","[{""id"":12,""name"":""Adventure""},{""id"":18,""name"":""Drama""}]",Released,19.72,,7.064,1942,1969-06-26
498,"The Killing Fields","The Killing Fields",en,"New York Times reporter Sydney Schanberg is on assignment covering the Cambodian Civil War, with the help of local interpreter Dith Pran and American photojournalist Al Rockoff. When the U.S. Army pulls out amid escalating violence, Schanberg makes exit arrangements for Pran and his family. Pran, however, tells Schanberg he intends to stay in Cambodia to help cover the unfolding story — a decision he may regret as the Khmer Rouge rebels move in.","[{""id"":18,""name"":""Drama""},{""id"":36,""name"":""History""},{""id"":10752,""name"":""War""}]",Released,13.721,,7.472,727,1984-11-23
499,"Un Chien Andalou","Un chien andalou",fr,"Un Chien Andalou is an European avant-garde surrealist film, a collaboration between director Luis Buñuel and Salvador Dali.","[{""id"":27,""name"":""Horror""},{""id"":14,""name"":""Fantasy""}]",Released,10.119,,7.427,1286,1929-06-05
500,Trainspotting,Trainspotting,en,"Heroin addict Mark Renton stumbles through bad ideas and sobriety attempts with his unreliable friends -- Sick Boy, Begbie, Spud and Tommy. He also has an underage girlfriend, Diane, along for the ride. After cleaning up and moving from Edinburgh to London, Mark finds he can't escape the life he left behind when Begbie shows up at his front door on the lam, and a scheming Sick Boy follows.","[{""id"":18,""name"":""Drama""},{""id"":80,""name"":""Crime""}]",Released,25.26,,7.965,9592,1996-02-23
501,"Interview with the Vampire","Interview with the Vampire",en,"A vampire relates his epic life story of love, betrayal, loneliness, and dark hunger to an over-curious reporter.","[{""id"":27,""name"":""Horror""},{""id"":18,""name"":""Drama""},{""id"":14,""name"":""Fantasy""}]",Released,38.874,,7.4,5811,1994-11-11
502,"The Usual Suspects","The Usual Suspects",en,"Held in an L.A. interrogation room, Verbal Kint attempts to convince the feds that a mythic crime lord, Keyser Soze, not only exists, but was also responsible for drawing him and his four partners into a multi-million dollar heist that ended with an explosion in San Pedro harbor – leaving few survivors. Verbal lures his interrogators with an incredible story of the crime lord's almost supernatural prowess.","[{""id"":18,""name"":""Drama""},{""id"":80,""name"":""Crime""},{""id"":53,""name"":""Thriller""}]",Released,56.111,,8.182,10331,1995-07-19
503,"The Wizard of Oz","The Wizard of Oz",en,"Young Dorothy finds herself in a magical world where she makes friends with a lion, a scarecrow and a tin man as they make their way along the yellow brick road to talk with the Wizard and ask for the things they miss most in their lives. The Wicked Witch of the West is the only thing that could stop them.","[{""id"":12,""name"":""Adventure""},{""id"":14,""name"":""Fantasy""},{""id"":10751,""name"":""Family""}]",Released,88.552,,7.586,5503,1939-08-15
504,"Sunrise: A Song of Two Humans","Sunrise: A Song of Two Humans",en,"A married farmer falls under the spell of a slatternly woman from the city, who tries to convince him to drown his wife.","[{""id"":18,""name"":""Drama""},{""id"":10749,""name"":""Romance""}]",Released,14.472,,7.848,796,1927-11-04
505,"Stalag 17","Stalag 17",en,"It's a dreary Christmas 1944 for the American POWs in Stalag 17 and the men in Barracks 4, all sergeants, have to deal with a grave problem—there seems to be a security leak.","[{""id"":35,""name"":""Comedy""},{""id"":18,""name"":""Drama""},{""id"":10752,""name"":""War""}]",Released,9.068,,7.696,592,1953-05-29
506,"Soldier of Orange","Soldaat van Oranje",nl,"The lives of Erik Lanshof and five of his closest friends take different paths when the German army invades the Netherlands in 1940: fight and resistance, fear and resignation, collaboration and high treason.","[{""id"":18,""name"":""Drama""},{""id"":53,""name"":""Thriller""},{""id"":10752,""name"":""War""}]",Released,9.668,,7.079,152,1977-09-22
507,"Bridget Jones's Diary","Bridget Jones's Diary",en,"Bridget Jones is an average woman struggling against her age, her weight, her job, her lack of a man, and her various imperfections. As a New Year's resolution, Bridget decides to take control of her life, starting by keeping a diary in which she will always tell the complete truth. The fireworks begin when her charming though disreputable boss takes an interest in the quirky Miss Jones. Thrown into the mix are Bridget's band of slightly eccentric friends and a rather disagreeable acquaintance into whom Bridget cannot seem to stop running or help finding quietly attractive.","[{""id"":35,""name"":""Comedy""},{""id"":10749,""name"":""Romance""},{""id"":18,""name"":""Drama""}]",Released,40.357,,6.8,4986,2001-04-13
508,"Angel Heart","Angel Heart",en,"A down-and-out Brooklyn detective is hired to track down a singer on an odyssey that will take him through the desperate streets of Harlem, the smoke-filled jazz clubs of New Orleans, and the swamps of Louisiana and its seedy underworld of voodoo.","[{""id"":27,""name"":""Horror""},{""id"":9648,""name"":""Mystery""}]",Released,21.844,,7.131,1506,1987-03-06
509,"THX 1138","THX 1138",en,"People in the future live in a totalitarian society. A technician named THX 1138 lives a mundane life between work and taking a controlled consumption of drugs that the government uses to make puppets out of people. As THX is without drugs for the first time he has feelings for a woman and they start a secret relationship.","[{""id"":878,""name"":""Science Fiction""},{""id"":28,""name"":""Action""},{""id"":18,""name"":""Drama""}]",Released,16.985,,6.438,938,1971-03-11
510,"Life Is Beautiful","La vita è bella",it,"A touching story of an Italian book seller of Jewish ancestry who lives in his own little fairy tale. His creative and happy life would come to an abrupt halt when his entire family is deported to a concentration camp during World War II. While locked up he tries to convince his son that the whole thing is just a game.","[{""id"":35,""name"":""Comedy""},{""id"":18,""name"":""Drama""}]",Released,46.61,,8.448,13012,1997-12-20
511,"Lost Highway","Lost Highway",en,"A tormented jazz musician finds himself lost in an enigmatic story involving murder, surveillance, gangsters, doppelgängers, and an impossible transformation inside a prison cell.","[{""id"":18,""name"":""Drama""},{""id"":53,""name"":""Thriller""},{""id"":9648,""name"":""Mystery""}]",Released,18.58,,7.564,2561,1997-01-15
512,"When Harry Met Sally...","When Harry Met Sally...",en,"During their travel from Chicago to New York, Harry and Sally debate whether or not sex ruins a friendship between a man and a woman. Eleven years later, and they're still no closer to finding the answer.","[{""id"":35,""name"":""Comedy""},{""id"":10749,""name"":""Romance""},{""id"":18,""name"":""Drama""}]",Released,33.945,,7.4,4066,1989-07-21
513,"Catch Me If You Can","Catch Me If You Can",en,"A true story about Frank Abagnale Jr. who, before his 19th birthday, successfully conned millions of dollars worth of checks as a Pan Am pilot, doctor, and legal prosecutor. An FBI agent makes it his mission to put him behind bars. But Frank not only eludes capture, he revels in the pursuit.","[{""id"":18,""name"":""Drama""},{""id"":80,""name"":""Crime""}]",Released,61.6,,7.978,15575,2002-12-16
514,"Requiem for a Dream","Requiem for a Dream",en,"The drug-induced utopias of four Coney Island residents are shattered when their addictions run deep.","[{""id"":80,""name"":""Crime""},{""id"":18,""name"":""Drama""}]",Released,21.108,,8,9910,2000-10-06
515,"Butch Cassidy and the Sundance Kid","Butch Cassidy and the Sundance Kid",en,"In late 1890s Wyoming, Butch Cassidy is the affable, clever and talkative leader of the outlaw Hole in the Wall Gang. His closest companion is the laconic dead-shot Sundance Kid. As the west rapidly becomes civilized, the law finally catches up to Butch, Sundance and their gang.  Chased doggedly by a special posse, the two decide to make their way to South America in hopes of evading their pursuers once and for all.","[{""id"":37,""name"":""Western""},{""id"":12,""name"":""Adventure""}]",Released,23.775,,7.6,2170,1969-09-23
516,"Battleship Potemkin","Броненосец Потёмкин",ru,"A dramatized account of a great Russian naval mutiny and a resultant public demonstration, showing support, which brought on a police massacre. The film had an incredible impact on the development of cinema and is a masterful example of montage editing.","[{""id"":18,""name"":""Drama""},{""id"":36,""name"":""History""},{""id"":10752,""name"":""War""}]",Released,14.338,,7.6,1147,1925-12-24
517,"A.I. Artificial Intelligence","A.I. Artificial Intelligence",en,"David, a robotic boy—the first of his kind programmed to love—is adopted as a test case by a Cybertronics employee and his wife. Though he gradually becomes their child, a series of unexpected circumstances make this life impossible for David.","[{""id"":18,""name"":""Drama""},{""id"":878,""name"":""Science Fiction""},{""id"":12,""name"":""Adventure""}]",Released,34.368,,7.044,6104,2001-06-29
518,"Dr. No","Dr. No",en,"Agent 007 battles mysterious Dr. No, a scientific genius bent on destroying the U.S. space program. As the countdown to disaster begins, Bond must go to Jamaica, where he encounters beautiful Honey Ryder, to confront a megalomaniacal villain in his massive island headquarters.","[{""id"":12,""name"":""Adventure""},{""id"":28,""name"":""Action""},{""id"":53,""name"":""Thriller""}]",Released,31.045,,7,3567,1962-10-07
519,"Final Fantasy VII: Advent Children","Final Fantasy VII: Advent Children",ja,"Two years have passed since the final battle with Sephiroth. Though Midgar, city of mako, city of prosperity, has been reduced to ruins, its people slowly but steadily walk the road to reconstruction. However, a mysterious illness called Geostigma torments them. With no cure in sight, it brings death to the afflicted, one after another, robbing the people of their fledgling hope.","[{""id"":16,""name"":""Animation""},{""id"":28,""name"":""Action""},{""id"":12,""name"":""Adventure""},{""id"":14,""name"":""Fantasy""},{""id"":878,""name"":""Science Fiction""}]",Released,16.484,,7.141,1135,2005-07-14
520,"Beauty and the Beast","La Belle et la Bête",fr,"The story of a gentle-hearted beast in love with a simple and beautiful girl. She is drawn to the repellent but strangely fascinating Beast, who tests her fidelity by giving her a key, telling her that if she doesn't return it to him by a specific time, he will die of grief. She is unable to return the key on time, but it is revealed that the Beast is the genuinely handsome one. A simple tale of tragic love that turns into a surreal vision of death, desire, and beauty.","[{""id"":18,""name"":""Drama""},{""id"":14,""name"":""Fantasy""},{""id"":10749,""name"":""Romance""}]",Released,16.296,,7.492,587,1946-10-29
