id,name,original_title,original_language,overview,genres,status,popularity,adult,vote_average,vote_count,release_date
1440,"Viva Las Vegas","Viva Las Vegas",en,"Lucky Jackson arrives in town with his car literally in tow ready for the first Las Vegas Grand Prix - once he has the money to buy an engine. He gets the cash easily enough but mislays it when the pretty swimming pool manageress takes his mind off things. It seems he will lose both race and girl, problems made more difficult by rivalry from Elmo Mancini, fellow racer and womaniser.","[{""id"":10402,""name"":""Music""},{""id"":10749,""name"":""Romance""},{""id"":35,""name"":""Comedy""}]",Released,14.418,,6.2,137,1964-02-08
1441,"Raw Deal","Raw Deal",en,"Mark Kaminsky is kicked out of the FBI for his rough treatment of a suspect. He winds up as the sheriff of a small town in North Carolina. FBI Chief Harry Shannon, whose son has been killed by a mobster named Patrovina, enlists Kaminsky in a personal vendetta with a promise of reinstatement into the FBI if Patrovina is taken down. To accomplish this, he must go undercover and join Patrovina's gang.","[{""id"":28,""name"":""Action""},{""id"":80,""name"":""Crime""},{""id"":53,""name"":""Thriller""}]",Released,13.463,,5.811,773,1986-06-06
1442,"The Last Castle","The Last Castle",en,"A court-martialed general rallies together 1200 inmates to rise against the system that put him away.","[{""id"":28,""name"":""Action""},{""id"":18,""name"":""Drama""},{""id"":53,""name"":""Thriller""}]",Released,18.049,,7.161,1248,2001-10-19
1443,"The Brother from Space","Fratello dello spazio",en,,"[{""id"":878,""name"":""Science Fiction""}]",Released,0.921,,2.5,4,1988-01-01
1444,"Solar Crisis","Solar Crisis",en,"A huge solar flare is predicted to fry the Earth. Astronauts aboard the spaceship Helios must go to the Sun to drop a bomb equipped with an Artificial Intelligence and a Japanese pilot at the right time so the flare will point somewhere else.","[{""id"":878,""name"":""Science Fiction""}]",Released,7.465,,4.4,28,1992-08-06
1445,Solaris,Solaris,en,"A troubled psychologist is sent to investigate the crew of an isolated research station orbiting a bizarre planet.","[{""id"":18,""name"":""Drama""},{""id"":878,""name"":""Science Fiction""},{""id"":9648,""name"":""Mystery""}]",Released,15.359,,5.909,1291,2002-11-27
1446,Requiem,Requiem,fr,"Four hardened crooks break out of prison. Hunted down, with nowhere to run, they seek refuge in the only place the police cannot follow, a Cistercian monastery. Cut off from the outside world, a nightmare stand off develops between the fugitives, ready to kill in defence of their dearly purchased freedom, and the monks they' re holding hostage. But in this potentially lethal confrontation, nothing is quite as it seems. The game' s been rigged from the start. Requiem' s a violent and fast paced French film that really delivers.","[{""id"":28,""name"":""Action""},{""id"":27,""name"":""Horror""},{""id"":53,""name"":""Thriller""}]",Released,1.525,,4.8,13,2001-12-28
1447,"American Pie","American Pie",en,"At a high-school party, four friends find that losing their collective virginity isn't as easy as they had thought. But they still believe that they need to do so before college. To motivate themselves, they enter a pact to all ""score"" by their senior prom.","[{""id"":35,""name"":""Comedy""},{""id"":10749,""name"":""Romance""}]",Released,61.813,,6.584,7626,1999-07-09
1448,"Hot Enough for June","Hot Enough for June",en,"A young man travels to Prague to join his new employer, unaware that he is being used as an espionage courier.","[{""id"":35,""name"":""Comedy""},{""id"":53,""name"":""Thriller""}]",Released,3.278,,6.1,21,1964-01-01
1449,"L.A. Story","L.A. Story",en,"With the help of a talking freeway billboard, a ""wacky weatherman"" tries to win the heart of an English newspaper reporter, who is struggling to make sense of the strange world of early-90s Los Angeles.","[{""id"":35,""name"":""Comedy""},{""id"":14,""name"":""Fantasy""},{""id"":10749,""name"":""Romance""}]",Released,8.854,,6.451,329,1991-02-08
1450,"The Breakfast Club","The Breakfast Club",en,"Five high school students from different walks of life endure a Saturday detention under a power-hungry principal. The disparate group includes rebel John, princess Claire, outcast Allison, brainy Brian and Andrew, the jock. Each has a chance to tell his or her story, making the others see them a little differently -- and when the day ends, they question whether school will ever be the same.","[{""id"":35,""name"":""Comedy""},{""id"":18,""name"":""Drama""}]",Released,27.542,,7.739,7953,1985-02-15
1451,"Rush Hour","Rush Hour",en,"When Hong Kong Inspector Lee is summoned to Los Angeles to investigate a kidnapping, the FBI doesn't want any outside help and assigns cocky LAPD Detective James Carter to distract Lee from the case. Not content to watch the action from the sidelines, Lee and Carter form an unlikely partnership and investigate the case themselves.","[{""id"":28,""name"":""Action""},{""id"":35,""name"":""Comedy""},{""id"":80,""name"":""Crime""}]",Released,53.476,,7.1,4908,1998-09-18
1452,Wasabi,Wasabi,fr,"Hubert is a French policeman with very sharp methods. After being forced to take 2 months off by his boss, who doesn't share his view on working methods, he goes back to Japan, where he used to work 19 years ago, to settle the probate of his girlfriend who left him shortly after marriage without a trace.","[{""id"":18,""name"":""Drama""},{""id"":28,""name"":""Action""},{""id"":35,""name"":""Comedy""}]",Released,20.91,,6.647,1273,2001-10-31
1453,"Balzac and the Little Chinese Seamstress",巴尔扎克与小裁缝,zh,"During the Cultural Revolution, two young men are sent to a remote mining village where they fall in love with the local tailor's beautiful granddaughter and discover a suitcase full of forbidden Western novels.","[{""id"":18,""name"":""Drama""}]",Released,6.09,,6.8,67,2002-05-16
1454,Payback,Payback,en,"With friends like these, who needs enemies? That's the question bad guy Porter is left asking after his wife and partner steal his heist money and leave him for dead -- or so they think. Five months and an endless reservoir of bitterness later, Porter's partners and the crooked cops on his tail learn how bad payback can be.","[{""id"":28,""name"":""Action""},{""id"":18,""name"":""Drama""},{""id"":80,""name"":""Crime""}]",Released,19.025,,6.8,1775,1999-02-05
1455,"Final Fantasy: The Spirits Within","Final Fantasy: The Spirits Within",en,"Led by a strange dream, scientist Aki Ross struggles to collect the eight spirits in the hope of creating a force powerful enough to protect the planet. With the aid of the Deep Eyes Squadron and her mentor, Dr. Sid, Aki must save the Earth from its darkest hate and unleash the spirits within.","[{""id"":12,""name"":""Adventure""},{""id"":28,""name"":""Action""},{""id"":14,""name"":""Fantasy""},{""id"":878,""name"":""Science Fiction""},{""id"":53,""name"":""Thriller""},{""id"":10749,""name"":""Romance""},{""id"":16,""name"":""Animation""}]",Released,16.035,,6.195,1454,2001-07-02
1456,"Light of Day","Light of Day",en,"Cleveland siblings rise with a rock band while coping with personal problems.","[{""id"":10402,""name"":""Music""},{""id"":18,""name"":""Drama""}]",Released,6.128,,5.4,47,1987-02-06
1457,"Out of Time","Out of Time",en,"Matt Lee Whitlock, respected chief of police in small Banyan Key, Florida, must solve a vicious double homicide before he himself falls under suspicion. Matt Lee has to stay a few steps ahead of his own police force and everyone he's trusted in order to find out the truth.","[{""id"":53,""name"":""Thriller""},{""id"":80,""name"":""Crime""},{""id"":18,""name"":""Drama""}]",Released,16.278,,6.331,1149,2003-10-03
1458,"Sophie Scholl: The Final Days","Sophie Scholl – Die letzten Tage",de,"In 1943, as Hitler continues to wage war across Europe, a group of college students mount an underground resistance movement in Munich. Dedicated expressly to the downfall of the monolithic Third Reich war machine, they call themselves the White Rose. One of its few female members, Sophie Scholl is captured during a dangerous mission to distribute pamphlets on campus with her brother Hans. Unwavering in her convictions and loyalty to the White Rose, her cross-examination by the Gestapo quickly escalates into a searing test of wills as Scholl delivers a passionate call to freedom and personal responsibility.","[{""id"":18,""name"":""Drama""},{""id"":36,""name"":""History""}]",Released,9.982,,7.137,416,2005-02-13
1459,"L.A. Confidential","L.A. Confidential",en,"Three detectives in the corrupt and brutal L.A. police force of the 1950s use differing methods to uncover a conspiracy behind the shotgun slayings of the patrons at an all-night diner.","[{""id"":80,""name"":""Crime""},{""id"":9648,""name"":""Mystery""},{""id"":53,""name"":""Thriller""}]",Released,26.159,,7.8,4894,1997-09-19
1460,"Days of Thunder","Days of Thunder",en,"Talented but unproven stock car driver Cole Trickle gets a break and with the guidance of veteran Harry Hogge turns heads on the track. The young hotshot develops a rivalry with a fellow racer that threatens his career when the two smash their cars. But with the help of his doctor, Cole just might overcome his injuries-- and his fear.","[{""id"":12,""name"":""Adventure""},{""id"":28,""name"":""Action""},{""id"":18,""name"":""Drama""}]",Released,19.986,,6.36,1461,1990-06-27
1461,Cedric,Cedric,de,"Death as a global service provider? Unthinkable! So far Death has thought that too. But then his nephew Cedric had the crazy idea of founding the company AFTER LIFE while his uncle was away. This company takes over the craft of death with the latest technology and markets it worldwide.","[{""id"":16,""name"":""Animation""},{""id"":10751,""name"":""Family""}]",Released,0.837,,0,0,2006-01-01
1462,"The Whole Ten Yards","The Whole Ten Yards",en,"Jimmy ""The Tulip"" Tudeski now spends his days compulsively cleaning his house and perfecting his culinary skills with his wife, Jill, a purported assassin who has yet to pull off a clean hit. Suddenly, an uninvited and unwelcome connection to their past unexpectedly shows up on Jimmy and Jill's doorstep; it's Oz, and he's begging them to help him rescue his wife, Cynthia.","[{""id"":35,""name"":""Comedy""},{""id"":53,""name"":""Thriller""},{""id"":80,""name"":""Crime""}]",Released,13,,5.738,938,2004-04-07
1463,"Me, Myself & Irene","Me, Myself & Irene",en,"Rhode Island State Trooper Charlie Baileygates has a multiple personality disorder. One personality is crazy and aggressive, while the other is more friendly and laid back. Both of these personalities fall in love with the same woman named Irene after Charlie loses his medication.","[{""id"":35,""name"":""Comedy""}]",Released,58.675,,6.596,3827,2000-06-22
1464,"Color of Night","Color of Night",en,"A color-blind psychiatrist is stalked by an unknown killer after taking over his murdered friend's therapy group and becomes embroiled in an intense affair with a mysterious woman who may be connected to the crime.","[{""id"":10749,""name"":""Romance""},{""id"":9648,""name"":""Mystery""},{""id"":53,""name"":""Thriller""}]",Released,21.84,,5.74,559,1994-08-19
1465,Wedlock,Wedlock,en,"A male prison escapee heads for his hidden loot, electronically attached to a female prisoner.","[{""id"":28,""name"":""Action""},{""id"":878,""name"":""Science Fiction""},{""id"":53,""name"":""Thriller""},{""id"":18,""name"":""Drama""},{""id"":80,""name"":""Crime""}]",Released,7.264,,5.688,154,1991-05-10
1466,"I Love You, Baby","I Love You, Baby",de,,"[{""id"":18,""name"":""Drama""},{""id"":35,""name"":""Comedy""},{""id"":53,""name"":""Thriller""},{""id"":10749,""name"":""Romance""}]",Released,2.153,,0,0,2000-04-20
1467,"Hostile Waters","Hostile Waters",en,"Based on true events, an American submarine collides into a Soviet sub of the coast of America and an ensuing standoff occurs that could lead to total annihilation.","[{""id"":10770,""name"":""TV Movie""},{""id"":18,""name"":""Drama""},{""id"":53,""name"":""Thriller""},{""id"":10752,""name"":""War""}]",Released,6.18,,5.646,24,1997-10-18
1468,"Totally Blonde","Totally Blonde",en,"Meg Peters just can't seem to find Mr. Right, she bleaches her hair blonde and we answer the age old question ""Do blondes really have more fun?""","[{""id"":35,""name"":""Comedy""}]",Released,1.144,,4.1,7,2001-01-01
1469,"The Perfect Storm","The Perfect Storm",en,"In October 1991, a confluence of weather conditions combined to form a killer storm in the North Atlantic. Caught in the storm was the sword-fishing boat Andrea Gail.","[{""id"":28,""name"":""Action""},{""id"":12,""name"":""Adventure""},{""id"":18,""name"":""Drama""},{""id"":53,""name"":""Thriller""}]",Released,21.679,,6.476,2281,2000-06-29
1470,"The Time Machine","The Time Machine",en,"A Victorian Englishman travels to the far future and finds that humanity has divided into two hostile species.","[{""id"":53,""name"":""Thriller""},{""id"":12,""name"":""Adventure""},{""id"":14,""name"":""Fantasy""},{""id"":878,""name"":""Science Fiction""},{""id"":10749,""name"":""Romance""}]",Released,15.617,,7.341,813,1960-05-25
1471,"The Time Machine","The Time Machine",en,"Hoping to alter the events of the past, a 19th century inventor instead travels 800,000 years into the future, where he finds mankind divided into two warring races.","[{""id"":878,""name"":""Science Fiction""},{""id"":12,""name"":""Adventure""},{""id"":28,""name"":""Action""}]",Released,26.243,,6.26,2250,2002-03-04
1472,"Hangin' Out","Gib Gas - Ich will Spaß",de,"The pert Tina is sick of school and the muff in her Bavarian village. She wants to go with Tino - attendant of a visiting auto-scooter - who has to leave the place for dubious reasons. However he lets her down and leaves alone. Now Tina persuades fellow student Robby, who has a crush on her, to take her on a random trip with his motor-scooter. It seems only to be a matter of time until he realizes that she's just using him to follow her boyfriend - or will the shy Robby manage to win her heart on their chaotic journey?","[{""id"":35,""name"":""Comedy""}]",Released,1.815,,4.1,14,1983-02-03
1473,"The Storm Riders",風雲：雄霸天下,zh,"Heeding a prophecy, a warlord trains two orphans after killing their parents. But the skills he teaches could lead to his downfall.","[{""id"":14,""name"":""Fantasy""},{""id"":28,""name"":""Action""},{""id"":12,""name"":""Adventure""}]",Released,14.136,,6.4,96,1998-07-18
1474,"Berlin Snuff - Straßen der Gewalt","Berlin Snuff - Straßen der Gewalt",de,"A private TV station sends its employees out to capture the dark side of Berlin. With the help of police radio, they are drawn to murders, rapes and other crimes which they then film in gory detail.","[{""id"":35,""name"":""Comedy""},{""id"":27,""name"":""Horror""}]",Released,0.876,,5,2,1995-01-01
1475,"Cleopatra Jones and the Casino of Gold","Cleopatra Jones and the Casino of Gold",en,"When fellow operatives and friends disappear during a mission in Hong Kong, Cleopatra Jones comes to help. She discovers the disappearance involves The Dragon Lady, a feared lipstick lesbian who runs a casino and the local drug trade.","[{""id"":28,""name"":""Action""},{""id"":12,""name"":""Adventure""},{""id"":18,""name"":""Drama""}]",Released,1.655,,5.8,26,1975-07-11
1476,"Kiss of the Dragon","Kiss of the Dragon",en,"Liu Jian, an elite Chinese police officer, comes to Paris to arrest a Chinese drug lord. When Jian is betrayed by a French officer and framed for murder, he must go into hiding and find new allies.","[{""id"":28,""name"":""Action""},{""id"":80,""name"":""Crime""},{""id"":53,""name"":""Thriller""}]",Released,20.639,,6.866,1179,2001-07-06
1477,"James Dean","James Dean",en,"The man behind the legend and a knowing look at the 1950's Hollywood are revealed in this dynamic bioepic of the meteoric star whose troubled life echoed his gut-grabbing performances in East of Eden, Rebel Without A Cause and Giant.","[{""id"":18,""name"":""Drama""},{""id"":10770,""name"":""TV Movie""}]",Released,10.34,,6.814,105,2001-08-04
1478,"Cop Land","Cop Land",en,"Freddy Heflin is the sheriff of a place everyone calls “Cop Land” — a small and seemingly peaceful town populated by the big city police officers he’s long admired. Yet something ugly is taking place behind the town’s peaceful facade. And when Freddy uncovers a massive, deadly conspiracy among these local residents, he is forced to take action and make a dangerous choice between protecting his idols and upholding the law.","[{""id"":80,""name"":""Crime""},{""id"":18,""name"":""Drama""},{""id"":53,""name"":""Thriller""}]",Released,13.03,,6.78,1566,1997-08-15
1479,"Carla's Song","Carla's Song",en,"A Glasgow man visits war-torn Nicaragua with a refugee tormented by her memories.","[{""id"":10752,""name"":""War""},{""id"":18,""name"":""Drama""},{""id"":10749,""name"":""Romance""}]",Released,5.716,,6.8,81,1996-10-30
1480,"One Night at McCool's","One Night at McCool's",en,"On an ordinary night, in an ordinary part of town, a beautiful young woman walks into a bar. Her name is Jewel, and before long she is chatting to bartender Randy. The pair leave together, but he ends up getting into a tussle with her criminal boyfriend, who she then shoots dead, later persuading Randy to take the rap for her. But this isn't the end of it, as both Randy's cousin Carl and the detective assigned to the murder case also fall for Jewel's charms and find themselves caught up in the ensuing events. It seems that any man who meets Jewel falls instantly in love with her, and she's going to use this fully to her own advantage, leaving a trail of havoc in her wake. It also seems that she is going to get away with it - that is, until Randy decides to hire a hitman...","[{""id"":35,""name"":""Comedy""},{""id"":80,""name"":""Crime""}]",Released,10.167,,5.845,333,2001-04-19
1481,"Feel the Motion","Der Formel Eins Film",de,"Young Tina has a big dream, she wants to become a successful pop singer. That's why she tries her luck in the music show 'Formel Eins'. There she meets all kinds of stars like Falco, Meat Loaf, Die Toten Hosen and Pia Zadora and of course the presenter Ingolf Lück. The result is a colorful mix-up and the question arises as to whether Tina can make her dream come true.","[{""id"":35,""name"":""Comedy""},{""id"":10402,""name"":""Music""}]",Released,1.933,,2.9,9,1985-07-05
1482,"The Flickering Flame","The Flickering Flame",en,"Documentary following dockers of Liverpool sacked in a labour dispute and their supporters’ group, Women of the Waterfront, as they receive support from around the world and seek solidarity at the TUC conference.","[{""id"":99,""name"":""Documentary""}]",Released,0.848,,5.7,6,1996-12-18
1483,"The Cotton Club","The Cotton Club",en,"Harlem's legendary Cotton Club becomes a hotbed of passion and violence as the lives and loves of entertainers and gangsters collide.","[{""id"":80,""name"":""Crime""},{""id"":18,""name"":""Drama""}]",Released,10.747,,6.519,397,1984-12-14
1484,"Body of Evidence","Body of Evidence",en,"When an elderly millionaire is found dead with cocaine in his system, his will leaves $8 million to Rebecca Carlson, who was having an affair with him. District attorney Robert Garrett decides to prosecute Rebecca, arguing that she deliberately engaged in wild sex with the old man to overexcite him and lead to his premature death. Defense attorney Frank Dulaney defends Rebecca in court while getting sucked into a dangerous affair with her.","[{""id"":18,""name"":""Drama""},{""id"":53,""name"":""Thriller""},{""id"":10749,""name"":""Romance""}]",Released,18.254,,4.985,301,1993-01-15
1485,"Man with the Screaming Brain","Man with the Screaming Brain",en,"The brains of a Russian taxi driver and a wealthy businessman are brought together in one body by a mad scientist.","[{""id"":35,""name"":""Comedy""},{""id"":27,""name"":""Horror""},{""id"":878,""name"":""Science Fiction""}]",Released,9.961,,5.102,88,2005-04-03
1486,"Dixie Chicks: Shut Up and Sing","Dixie Chicks: Shut Up and Sing",en,"Shut Up and Sing is a documentary about the country band from Texas called the Dixie Chicks and how one tiny comment against President Bush dropped their number one hit off the charts and caused fans to hate them, destroy their CD’s, and protest at their concerts. A film about freedom of speech gone out of control and the three girls lives that were forever changed by a small anti-Bush comment","[{""id"":10402,""name"":""Music""},{""id"":99,""name"":""Documentary""}]",Released,4.481,,6.7,43,2006-10-27
1487,"The Driver","The Driver",en,"The Driver specializes in driving getaway cars for robberies. His exceptional talent has prevented him from being caught yet. After another successful flight from the police a self-assured detective makes it his primary goal to catch the Driver. He promises pardons to a gang if they help to convict him in a set-up robbery. The Driver seeks help from The Player to mislead the detective.","[{""id"":80,""name"":""Crime""},{""id"":53,""name"":""Thriller""},{""id"":28,""name"":""Action""}]",Released,11.58,,7.156,434,1978-06-08
1488,"The Dark Side of the Moon","The Dark Side of the Moon",en,"It is the year 2022. A mysterious systems failure causes the crew of a spaceship to be stranded on the dark side of the moon, while rapidly running out of fuel and oxygen. They are surprised to discover a NASA space shuttle floating in space, and board it in the hope of salvaging some supplies. One by one, the crew is possessed and killed, and it is up to Paxton Warner to find the links between the dark side of the moon, the Bermuda Triangle, and the Devil himself.","[{""id"":27,""name"":""Horror""},{""id"":28,""name"":""Action""},{""id"":53,""name"":""Thriller""},{""id"":878,""name"":""Science Fiction""}]",Released,12.024,,5,72,1990-05-30
1489,"Reindeer Games","Reindeer Games",en,"After assuming his dead cellmate's identity to get with his girlfriend, an ex-con finds himself the reluctant participant in a casino heist.","[{""id"":53,""name"":""Thriller""},{""id"":28,""name"":""Action""},{""id"":80,""name"":""Crime""}]",Released,12.347,,5.682,643,2000-02-25
1490,"Net Games","Net Games",en,"The successful publicist Adam Vance of the SFC is in the middle of a campaign to get an important Japanese client and is needy of sex because his traumatized wife Jennifer Vance was raped one year ago and is totally frigid, refusing to have sex. His close friend and colleague Ray Walters suggests Adam to visit the porn site cyber chat.net, where lonely people have erotic conversation. Adam meets Angel, a luscious woman and hacker while his wife is visiting her rapist in the prison with her therapist as part of her treatment. When Adam decides to finish his virtual affair with Angel, he is chased and blackmailed by the deranged sexy killer.","[{""id"":53,""name"":""Thriller""},{""id"":10749,""name"":""Romance""}]",Released,3.134,,5,8,2003-02-02
1491,"Lost in Space","Lost in Space",en,"The prospects for continuing life on Earth in the year 2058 are grim. So the Robinsons are launched into space to colonize Alpha Prime, the only other inhabitable planet in the galaxy. But when a stowaway sabotages the mission, the Robinsons find themselves hurtling through uncharted space.","[{""id"":878,""name"":""Science Fiction""},{""id"":12,""name"":""Adventure""}]",Released,17.428,,5.399,1203,1998-04-03
1492,"Voyage to the Bottom of the Sea","Voyage to the Bottom of the Sea",en,"The crew of an atomic submarine battle to save the world from global destruction.","[{""id"":12,""name"":""Adventure""},{""id"":18,""name"":""Drama""},{""id"":878,""name"":""Science Fiction""}]",Released,11.05,,5.7,123,1961-07-12
1493,"Fantastic Voyage","Fantastic Voyage",en,"In order to save an assassinated scientist, a submarine and its crew are shrunk to microscopic size and injected into his bloodstream.","[{""id"":878,""name"":""Science Fiction""},{""id"":12,""name"":""Adventure""}]",Released,12.174,,6.669,435,1966-08-24
1494,"Chill Factor","Chill Factor",en,"A store clerk and an ice cream truck driver are thrown together when a dying scientist entrusts them with a deadly chemical kept in ice. This chemical will kill every living thing once it melts. They have to take the chemical codenamed 'Elvis' to the next nearest military base while being chased by terrorists who want it to hold the country for ransom.","[{""id"":28,""name"":""Action""},{""id"":35,""name"":""Comedy""},{""id"":53,""name"":""Thriller""}]",Released,8.06,,4.903,134,1999-09-01
1495,Breakdown,Breakdown,en,"When his SUV breaks down on a remote Southwestern road, Jeff Taylor lets his wife, Amy, hitch a ride with a trucker to get help. When she doesn't return, Jeff fixes his SUV and tracks down the trucker -- who tells the police he's never seen Amy. Johnathan Mostow's tense thriller then follows Jeff's desperate search for his wife, which eventually uncovers a small town's murderous secret.","[{""id"":80,""name"":""Crime""},{""id"":9648,""name"":""Mystery""},{""id"":53,""name"":""Thriller""}]",Released,18.74,,6.9,915,1997-05-02
1496,Stargate,Stargate,en,"An interstellar teleportation device, found in Egypt, leads to a planet with humans resembling ancient Egyptians who worship the god Ra.","[{""id"":28,""name"":""Action""},{""id"":12,""name"":""Adventure""},{""id"":878,""name"":""Science Fiction""}]",Released,30.691,,7,3398,1994-10-28
