id,name,original_title,original_language,overview,genres,status,popularity,adult,vote_average,vote_count,release_date
914,"Lights in the Dusk","Laitakaupungin valot",fi,"Outcast by his co-workers and living alone, Koistinen is a security guard who works the night shift in a luxury shopping mall in Helsinki. But when icy blonde Mirja approaches him, the lonely Koistinen falls helplessly for her, unaware she is manipulating him for her criminal boyfriend.","[{""id"":18,""name"":""Drama""},{""id"":35,""name"":""Comedy""}]",Released,11.379,,6.7,137,2006-02-03
915,"Gleaming the Cube","Gleaming the Cube",en,"An Orange County teenager's carefree life of ditching class and skateboarding abandoned pools comes to a screeching halt when someone close to him dies. The cops rule the death a suicide, but the bereaved skater believes he was murdered. It's up to him to solve the case, with a skateboard.","[{""id"":80,""name"":""Crime""},{""id"":53,""name"":""Thriller""},{""id"":28,""name"":""Action""}]",Released,10.589,,5.9,131,1989-01-13
916,"The Fountain","The Fountain",en,"Spanning over one thousand years, and three parallel stories, The Fountain is a story of love, death, spirituality, and the fragility of our existence in this world.","[{""id"":18,""name"":""Drama""},{""id"":12,""name"":""Adventure""},{""id"":878,""name"":""Science Fiction""},{""id"":10749,""name"":""Romance""}]",Released,18.78,,6.931,2744,2006-11-22
917,"Me and You and Everyone We Know","Me and You and Everyone We Know",en,"Single dad Richard meets Christine, a starving artist who moonlights as a cabbie. They awkwardly attempt to start a romance, but Richard’s divorce has left him emotionally damaged. Meanwhile, Richard’s sons—one a teenager, the other 6-years-old—take part in clumsy experiments with the opposite sex.","[{""id"":35,""name"":""Comedy""},{""id"":18,""name"":""Drama""}]",Released,8.136,,6.961,320,2005-06-17
918,Rendezvous,"C'était un rendez-vous",fr,"A high-speed drive through the streets of Paris.","[{""id"":28,""name"":""Action""},{""id"":10749,""name"":""Romance""}]",Released,5.164,,7.273,75,1976-01-01
919,"Superstar: The Karen Carpenter Story","Superstar: The Karen Carpenter Story",en,"The final 17 years of American singer and musician Karen Carpenter, performed almost entirely by modified Barbie dolls.","[{""id"":18,""name"":""Drama""},{""id"":10402,""name"":""Music""},{""id"":16,""name"":""Animation""}]",Released,4.953,,7.091,55,1987-07-15
920,"The Way Things Go","Der Lauf der Dinge",en,"Artists Peter Fischli and David Weiss create the ultimate Rube Goldberg machine. The pair used found objects to construct a complex, interdependent contraption in an empty warehouse. When set in motion, a domino-like chain reaction ripples through the complex of imaginative devices. Fire, water, the laws of gravity, and chemistry determine the life-cycle of the objects. The process reveals a story concerning cause and effect, mechanism and art, and improbability and precision, in an extended science project that will mesmerize the mind.","[{""id"":99,""name"":""Documentary""}]",Released,3.4,,6.5,24,1987-06-01
921,"Out of Sight","Out of Sight",en,"Meet Jack Foley, a smooth criminal who bends the law and is determined to make one last heist. Karen Sisco is a federal marshal who chooses all the right moves … and all the wrong guys. Now they're willing to risk it all to find out if there's more between them than just the law.","[{""id"":10749,""name"":""Romance""},{""id"":35,""name"":""Comedy""},{""id"":80,""name"":""Crime""}]",Released,14.147,,6.673,1240,1998-06-26
922,"Y Tu Mamá También","Y tu mamá también",es,"In Mexico, two teenage boys and an attractive older woman embark on a road trip and learn a thing or two about life, friendship, sex, and each other.","[{""id"":18,""name"":""Drama""},{""id"":10749,""name"":""Romance""}]",Released,32.094,,7.412,1491,2001-06-08
923,"Born Into Brothels: Calcutta's Red Light Kids","Born Into Brothels: Calcutta's Red Light Kids",en,"Documentary depicting the lives of child prostitutes in the red light district of Songachi, Calcutta. Director Zana Briski went to photograph the prostitutes when she met and became friends with their children. Briski began giving photography lessons to the children and became aware that their photography might be a way for them to lead better lives.","[{""id"":99,""name"":""Documentary""}]",Released,10.94,,6.9,222,2004-12-08
924,"The Cave of the Yellow Dog","Шар нохойн там",mn,"The little nomad girl, Nansal, finds a baby dog in the Mongolian veld, who becomes her best friend - against all rejections of her parents. A story about a Mongolian family of nomads - their traditional way of life and the rising call of the City.","[{""id"":18,""name"":""Drama""}]",Released,4.935,,7.431,72,2005-07-27
925,Nostalgia,Ностальгия,ru,"A Russian poet, Andrei and his interpreter, Eugenia travel to Italy to research the life of an 18th-century composer.","[{""id"":18,""name"":""Drama""},{""id"":10749,""name"":""Romance""}]",Released,12.678,,7.844,524,1983-05-01
926,Mirror,Зеркало,ru,"A dying man in his forties recalls his childhood, his mother, the war and personal moments that tell of and juxtapose pivotal moments in Soviet history with daily life.","[{""id"":18,""name"":""Drama""},{""id"":36,""name"":""History""}]",Released,17.341,,7.968,942,1975-03-07
927,"Wege Gottes","Wege Gottes",en,,"[{""id"":99,""name"":""Documentary""}]",Released,2.28,,10,1,2007-01-01
928,Stalker,Сталкер,ru,"Near a gray and unnamed city is the Zone, a place guarded by barbed wire and soldiers, and where the normal laws of physics are victim to frequent anomalies. A stalker guides two men into the Zone, specifically to an area in which deep-seated desires are granted.","[{""id"":878,""name"":""Science Fiction""},{""id"":18,""name"":""Drama""}]",Released,26.491,,8.155,2150,1979-05-25
929,"The Pursuit of Happyness","The Pursuit of Happyness",en,"A struggling salesman takes custody of his son as he's poised to begin a life-changing professional career.","[{""id"":18,""name"":""Drama""}]",Released,58.259,,7.9,9799,2006-12-14
930,"Duel at Diablo","Duel at Diablo",en,"In Apache territory, a supply Army column heads for the next fort, an ex-scout searches for the killer of his Native wife, and a housewife abandons her husband to rejoin her Apache lover's tribe.","[{""id"":37,""name"":""Western""}]",Released,8.888,,6.3,99,1966-06-15
931,"Ae Fond Kiss...","Ae Fond Kiss...",en,"A young man upsets his Punjabi family when he falls in love with an Irish schoolteacher.","[{""id"":18,""name"":""Drama""},{""id"":10749,""name"":""Romance""}]",Released,10.284,,6.4,116,2004-02-13
932,Greed,Greed,en,"A lottery win of $5,000 forever changes the lives of a miner turned dentist and his wife.","[{""id"":18,""name"":""Drama""},{""id"":80,""name"":""Crime""}]",Released,13.518,,7.4,173,1924-12-04
933,"City Slickers","City Slickers",en,"Three New York businessmen decide to take a ""Wild West"" vacation that turns out not to be the relaxing vacation they had envisioned.","[{""id"":35,""name"":""Comedy""},{""id"":37,""name"":""Western""}]",Released,14.662,,6.43,757,1991-06-07
934,"La Vie en Rose","La Môme",fr,"From the mean streets of the Belleville district of Paris to the dazzling limelight of New York's most famous concert halls, Edith Piaf's life was a constant battle to sing and survive, to live and love. Raised in her grandmother's brothel, Piaf was discovered in 1935 by nightclub owner Louis Leplee, who persuaded her to sing despite her extreme nervousness. Piaf became one of France's immortal icons, her voice one of the indelible signatures of the 20th century.","[{""id"":10402,""name"":""Music""},{""id"":18,""name"":""Drama""}]",Released,12.828,,7.414,1593,2007-02-14
935,"Cutthroat Island","Cutthroat Island",en,"Morgan Adams and her slave, William Shaw, are on a quest to recover the three portions of a treasure map. Unfortunately, the final portion is held by her murderous uncle, Dawg. Her crew is skeptical of her leadership abilities, so she must complete her quest before they mutiny against her. This is made yet more difficult by the efforts of the British crown to end her pirate raids.","[{""id"":28,""name"":""Action""},{""id"":12,""name"":""Adventure""}]",Released,14.104,,5.8,540,1995-12-22
936,"Dark Star","Dark Star",en,"A group of scientists are sent on a mission to destroy unstable planets. Twenty years into their mission, they have to battle their alien mascot as well as a ""sensitive"" and intelligent bombing device that starts to question the meaning of its existence.","[{""id"":35,""name"":""Comedy""},{""id"":878,""name"":""Science Fiction""}]",Released,10.397,,5.932,550,1974-04-01
937,"The Rapture","The Rapture",en,"A lonely telephone operator leading an empty, amoral life finds God – only to have her faith continually tested in ways beyond what she could have imagined.","[{""id"":9648,""name"":""Mystery""},{""id"":18,""name"":""Drama""},{""id"":14,""name"":""Fantasy""}]",Released,17.445,,5.9,78,1991-10-04
938,"sex, lies, and videotape","sex, lies, and videotape",en,"Ann, a frustrated wife, enters into counseling due to a troubled marriage. Unbeknownst to her, her husband John has begun an affair with her sister. When John’s best friend Graham arrives, his penchant for interviewing women about their sex lives forever changes John and Ann’s rocky marriage.","[{""id"":18,""name"":""Drama""}]",Released,19.273,,6.948,902,1989-08-04
939,"M. Butterfly","M. Butterfly",en,"In 1960s China, French diplomat Rene Gallimard falls in love with an opera singer, Song Liling – but Song is not at all who Gallimard thinks.","[{""id"":10749,""name"":""Romance""},{""id"":18,""name"":""Drama""}]",Released,10.501,,6.573,220,1993-10-01
940,"Lovers of the Arctic Circle","Los amantes del Círculo Polar",es,"Otto and Ana are kids when they meet each other. Their names are palindromes. They meet by chance, people are related by chance. A story of circular lives, with circular names, and a circular place where the day never ends in the midnight sun. There are things that never end, and Love is one of them.","[{""id"":18,""name"":""Drama""},{""id"":9648,""name"":""Mystery""},{""id"":10749,""name"":""Romance""}]",Released,12.555,,7.358,239,1998-09-04
941,"Party Monster","Party Monster",en,"The New York club scene of the 80s and 90s was a world like no other. Into this candy-colored, mirror ball playground stepped Michael Alig, a wannabe from nowhere special. Under the watchful eye of veteran club kid James St. James, Alig quickly rose to the top... and there was no place to go but down.","[{""id"":35,""name"":""Comedy""},{""id"":18,""name"":""Drama""},{""id"":80,""name"":""Crime""}]",Released,8.327,,5.854,171,2003-09-05
942,"The Coast Guard",해안선,ko,"A member of Coast Guard Platoon 23, Private Kang monitors a high-infiltration stretch of beach lined with barbed-wire fencing. Driven by the belief that killing a spy is the highest honor, he waits for a chance to prove his worth.","[{""id"":18,""name"":""Drama""},{""id"":10752,""name"":""War""}]",Released,9.897,,6.3,85,2002-11-22
943,"Pan's Labyrinth","El laberinto del fauno",es,"Living with her tyrannical stepfather in a new home with her pregnant mother, 10-year-old Ofelia feels alone until she explores a decaying labyrinth guarded by a mysterious faun who claims to know her destiny. If she wishes to return to her real father, Ofelia must complete three terrifying tasks.","[{""id"":14,""name"":""Fantasy""},{""id"":18,""name"":""Drama""},{""id"":10752,""name"":""War""}]",Released,59.235,,7.757,10487,2006-10-10
944,"Take My Eyes","Te doy mis ojos",es,"One winter night, Pilar runs away from home. With her, she takes only a few belongings and her son, Juan. Antonio soon sets out to look for her. He says Pilar is his sunshine, and what's more, ""She gave him her eyes""...","[{""id"":10749,""name"":""Romance""},{""id"":18,""name"":""Drama""}]",Released,8.632,,7.221,201,2003-10-08
945,Vollidiot,Vollidiot,de,"Based on Tommy Jaud's bestselling novel, this comedy focuses on a dispassionate clerk and his set-backs in life. 29-year-old Simon works in a phone shop, but his thoughts just circle around finding a new girl-friend after being left by his last one year ago. While his Croatian cleaner tries to procure him, his efforts to chat up women in clubs also fail. However, he finds the woman of his dreams (and mother of their future children) in his most hated coffee shop, although not having a clue how to win her heart...","[{""id"":35,""name"":""Comedy""},{""id"":18,""name"":""Drama""}]",Released,4.643,,4.3,57,2007-04-11
946,"Breakfast on Pluto","Breakfast on Pluto",en,"In the 1970s, a young transgender woman called “Kitten” leaves her small Irish town for London in search of love, acceptance, and her long-lost mother.","[{""id"":18,""name"":""Drama""},{""id"":35,""name"":""Comedy""}]",Released,13.065,,7.183,379,2005-11-16
947,"The Man Who Loved Women","L'Homme qui aimait les femmes",fr,"At Bertrand Morane's burial there are many of the women that the 40-year-old engineer loved. In flashback Bertrand's life and love affairs are told by himself while writing an autobiographical novel.","[{""id"":18,""name"":""Drama""},{""id"":35,""name"":""Comedy""},{""id"":10749,""name"":""Romance""}]",Released,11.047,,7.2,184,1977-04-27
948,"The Departed","The Departed",en,"To take down South Boston's Irish Mafia, the police send in one of their own to infiltrate the underworld, not realizing the syndicate has done likewise. While an undercover cop curries favor with the mob kingpin, a career criminal rises through the police ranks. But both sides soon discover there's a mole among them.","[{""id"":18,""name"":""Drama""},{""id"":53,""name"":""Thriller""},{""id"":80,""name"":""Crime""}]",Released,77.308,,8.162,14827,2006-10-04
949,"Flying Saucer Rock 'N' Roll","Flying Saucer Rock 'N' Roll",en,"Flying Saucer Rock N Roll is the debut feature film from the father-son duo Eric and Joe Callero. The year is 1957 as a group of rockabilly and beatnik teens are visited by weed smoking Martian zombies who have come to take their earth women. Filmed with respect for classic horror films and full of laughs as the viewer is taken on an adventure like no other.","[{""id"":12,""name"":""Adventure""},{""id"":35,""name"":""Comedy""},{""id"":27,""name"":""Horror""},{""id"":878,""name"":""Science Fiction""}]",Released,1.179,,3,1,2006-03-18
950,November,November,en,"Sophie Jacobs is going through the most difficult time of her life. Now, she just has to find out if it's real.","[{""id"":18,""name"":""Drama""},{""id"":9648,""name"":""Mystery""},{""id"":53,""name"":""Thriller""}]",Released,4.027,,4.7,41,2004-01-18
951,"Maria am Wasser","Maria am Wasser",de,,"[{""id"":18,""name"":""Drama""}]",Released,2.057,,2.2,2,2007-03-08
952,"Perfume: The Story of a Murderer","Perfume: The Story of a Murderer",en,"Jean-Baptiste Grenouille, born in the stench of 18th century Paris, develops a superior olfactory sense, which he uses to create the world's finest perfumes. However, his work takes a dark turn as he tries to preserve scents in the search for the ultimate perfume.","[{""id"":80,""name"":""Crime""},{""id"":14,""name"":""Fantasy""},{""id"":18,""name"":""Drama""}]",Released,40.182,,7.4,4500,2006-09-13
953,"Once Upon a Time in Mexico","Once Upon a Time in Mexico",en,"A corrupt CIA agent Sands hires hitman El Mariachi to assassinate a Mexican general hired by a drug kingpin attempting a coup d'état of the President of Mexico.","[{""id"":28,""name"":""Action""},{""id"":18,""name"":""Drama""},{""id"":9648,""name"":""Mystery""}]",Released,26.581,,6.296,2134,2003-09-11
954,"25th Hour","25th Hour",en,"In New York City in the days following the events of 9/11, Monty Brogan is a convicted drug dealer about to start a seven-year prison sentence, and his final hours of freedom are devoted to hanging out with his closest buddies and trying to prepare his girlfriend for his extended absence.","[{""id"":80,""name"":""Crime""},{""id"":18,""name"":""Drama""}]",Released,17.803,,7.331,2325,2002-12-19
955,"Bowling for Columbine","Bowling for Columbine",en,"This is not a film about gun control. It is a film about the fearful heart and soul of the United States, and the 280 million Americans lucky enough to have the right to a constitutionally protected Uzi. From a look at the Columbine High School security camera tapes to the home of Oscar-winning NRA President Charlton Heston, from a young man who makes homemade napalm with The Anarchist's Cookbook to the murder of a six-year-old girl by another six-year-old. Bowling for Columbine is a journey through the US, through our past, hoping to discover why our pursuit of happiness is so riddled with violence.","[{""id"":99,""name"":""Documentary""},{""id"":18,""name"":""Drama""}]",Released,13.371,,7.5,1524,2002-10-09
956,"The Devil's Backbone","El espinazo del diablo",es,"Spain, 1939. In the last days of the Spanish Civil War, the young Carlos arrives at the Santa Lucía orphanage, where he will make friends and enemies as he follows the quiet footsteps of a mysterious presence eager for revenge.","[{""id"":14,""name"":""Fantasy""},{""id"":18,""name"":""Drama""},{""id"":27,""name"":""Horror""},{""id"":53,""name"":""Thriller""}]",Released,17.764,,7.284,1205,2001-04-20
957,Tarnation,Tarnation,en,"Filmmaker Jonathan Caouette's documentary on growing up with his schizophrenic mother -- a mixture of snapshots, Super-8, answering machine messages, video diaries, early short films, and more -- culled from 19 years of his life.","[{""id"":99,""name"":""Documentary""},{""id"":18,""name"":""Drama""}]",Released,6.745,,6.9,80,2003-10-19
958,"The Warrior",무사,ko,"In 1375, China was in chaos between Yuan Dynasty and Ming Dynasty. Coryo (an ancient kingdom of Korea then) sent a delegation of many diplomats, soldiers and a silent slave to make peace with the new Chinese government. However, this delegation got charged as spies and sent in exile to a remote desert.","[{""id"":36,""name"":""History""},{""id"":18,""name"":""Drama""},{""id"":28,""name"":""Action""},{""id"":10752,""name"":""War""}]",Released,10.555,,6.961,128,2001-09-07
959,Abgefahren,Abgefahren,de,"Mia is dreaming of one day being the youngest driver in the Dakar Rally. She's pretty and loves the challenge. One day she gets to know the driving instructor Sherin, an exotic beauty of mid-twenties. She takes Mia to a secret car race out of town.","[{""id"":28,""name"":""Action""},{""id"":35,""name"":""Comedy""}]",Released,2.137,,5.1,7,2004-03-31
960,Regoch,Regoch,en,,"[{""id"":16,""name"":""Animation""}]",Released,0.594,,10,2,2006-11-20
961,"Anna and the King","Anna and the King",en,"The story of the romance between the King of Siam (now Thailand) and the widowed British school teacher Anna Leonowens during the 1860s. Anna teaches the children and becomes romanced by the King. She convinces him that a man can be loved by just one woman.","[{""id"":18,""name"":""Drama""},{""id"":10749,""name"":""Romance""},{""id"":36,""name"":""History""}]",Released,14.14,,6.777,764,1999-12-16
962,"Little Children","Little Children",en,"The lives of two lovelorn spouses from separate marriages, a registered sex offender, and a disgraced ex-police officer intersect as they struggle to resist their vulnerabilities and temptations.","[{""id"":18,""name"":""Drama""},{""id"":10749,""name"":""Romance""}]",Released,16.184,,7.078,995,2006-10-06
963,"The Contract","The Contract",en,"Attempting to recover from a recent family trauma by escaping into the woods for a peaceful hiking trip, an ex-lawman and his young son stumble across a dangerous contract killer.","[{""id"":18,""name"":""Drama""},{""id"":28,""name"":""Action""},{""id"":53,""name"":""Thriller""},{""id"":80,""name"":""Crime""}]",Released,12.47,,5.723,496,2006-04-05
964,"Full Metal Village","Full Metal Village",de,"The film describes the microcosmos of the small village Wacken and shows the clash of the cultures, before and during the biggest heavy metal festival in Europe.","[{""id"":99,""name"":""Documentary""}]",Released,2.69,,6.7,20,2007-04-19
965,"The Virgin Suicides","The Virgin Suicides",en,"A group of male friends become obsessed with five mysterious sisters who are sheltered by their strict, religious parents.","[{""id"":18,""name"":""Drama""}]",Released,26.271,,7.118,3230,2000-04-21
966,Junebug,Junebug,en,"On the way to meet with an independent artist in the South, newlywed art dealer Madeleine is convinced by her husband, George, that they should stop to meet his family in North Carolina. Madeleine's affluent lifestyle clashes with the family, but she befriends George's wide-eyed and pregnant sister-in-law, Ashley, who is nearing her due date. Through the family, Madeleine gains greater insight into George's character.","[{""id"":35,""name"":""Comedy""},{""id"":18,""name"":""Drama""}]",Released,8.515,,6.57,220,2005-08-03
967,"The Wisdom of Crocodiles","The Wisdom of Crocodiles",en,"A vampire in London is searching for the ideal woman to 'redeem' him.","[{""id"":14,""name"":""Fantasy""},{""id"":27,""name"":""Horror""}]",Released,15.288,,5.846,91,1998-11-27
968,"Blood: The Last Vampire","Blood: The Last Vampire",en,"On the surface, Saya is a stunning 16-year-old, but that youthful exterior hides the tormented soul of a 400-year-old ""halfling"". Born to a human father and a vampire mother, she has for centuries been a loner obsessed with using her samurai skills to rid the world of vampires, all the while knowing that she herself can survive only on blood like those she hunts.","[{""id"":28,""name"":""Action""},{""id"":12,""name"":""Adventure""},{""id"":27,""name"":""Horror""},{""id"":878,""name"":""Science Fiction""},{""id"":53,""name"":""Thriller""}]",Released,14.778,,5.848,371,2009-04-02
969,"Superman Returns","Superman Returns",en,"Superman returns to discover his 5-year absence has allowed Lex Luthor to walk free, and that those he was closest to felt abandoned and have moved on. Luthor plots his ultimate revenge that could see millions killed and change the face of the planet forever, as well as ridding himself of the Man of Steel.","[{""id"":878,""name"":""Science Fiction""},{""id"":28,""name"":""Action""},{""id"":12,""name"":""Adventure""}]",Released,29.321,,5.773,4151,2006-06-28
970,"Clean, Shaven","Clean, Shaven",en,"Peter Winter is a young schizophrenic who is desperately trying to get his daughter back from her adoptive family. He attempts to function in a world that, for him, is filled with strange voices, electrical noise, disconcerting images, and jarringly sudden emotional shifts. During his quest, he runs afoul of the law and an ongoing murder investigation.","[{""id"":18,""name"":""Drama""},{""id"":80,""name"":""Crime""},{""id"":53,""name"":""Thriller""}]",Released,8.362,,6.413,92,1995-04-14
971,"Touch of Evil","Touch of Evil",en,"When a car bomb explodes on the American side of the U.S./Mexico border, Mexican drug enforcement agent Miguel Vargas begins his investigation, along with American police captain Hank Quinlan. When Vargas begins to suspect that Quinlan and his shady partner, Menzies, are planting evidence to frame an innocent man, his investigations into their possible corruption quickly put himself and his new bride, Susie, in jeopardy.","[{""id"":80,""name"":""Crime""},{""id"":53,""name"":""Thriller""},{""id"":9648,""name"":""Mystery""}]",Released,17.042,,7.757,1416,1958-03-30
972,"Metal Skin","Metal Skin",en,"Psycho Joe loves one thing: fast cars! When he gets a job at a local supermarket, Joe meets fellow ""petrol head"" Dazey, who quickly becomes his idol and best friend. Soon after, Joe falls for Savina, a goth girl who practices black magic. But Savina has already fallen for Dazey and will do anything to get him -- including using Joe's feelings for her. In true Shakespearean fashion, this trio race down the road to tragedy.","[{""id"":28,""name"":""Action""},{""id"":18,""name"":""Drama""}]",Released,3.46,,5.9,7,1994-02-21
973,"Laws of Gravity","Laws of Gravity",en,"Jimmy and Jon are a couple of Brooklyn guys who somehow never found their way into workaday society; they never found their way into big-time crime, either.","[{""id"":28,""name"":""Action""},{""id"":18,""name"":""Drama""}]",Released,4.041,,6.8,14,1992-03-21
974,Begotten,Begotten,en,"Begotten is the creation myth brought to life, the story of no less than the violent death of God and the (re)birth of nature on a barren earth.","[{""id"":14,""name"":""Fantasy""},{""id"":27,""name"":""Horror""}]",Released,9.475,,5.942,308,1991-06-05
975,"The Deathmaker","Der Totmacher",de,"Fritz Haarmann, who has killed at least 27 boys, is questioned by a psychology professor in order to find out whether he is sane and can be held responsible for his crimes. During this interrogation Haarmann reveals his motives and his killing methods.","[{""id"":18,""name"":""Drama""}]",Released,4.199,,6.7,32,1995-11-23
976,"Get Carter","Get Carter",en,"Jack Carter is a small-time hood working in London. When word reaches him of his brother's death, he travels to Newcastle to attend the funeral. Refusing to accept the police report of suicide, Carter seeks out his brother’s friends and acquaintances to learn who murdered his sibling and why.","[{""id"":80,""name"":""Crime""},{""id"":53,""name"":""Thriller""}]",Released,10.535,,6.991,483,1971-02-03
